{
  "v": "ACDC10JSON0002d4_",
  "d": "EGnqlwzSNFPcgefJCTa-I93Cqd007F9RKN4UHqpshSJ2",
  "i": "EMRlhEQK44_V5804rsRvQ99Gtf7uDpYQqZuvrw0LhV3S",
  "ri": "EKfi58Jiv-NVqr6GOrxgxzhrE5RsDaH4QNwv9rCyZCwZ",
  "s": "EPO1lEL6zV_EKOKBfeiJTOxg9HDB7s1pQI49SS2ywO7Y",
  "a": {
    "d": "EAafmNPPSSUsOQUMR7vBUaDEZ8MeMrkVgIFKkvX9DOUy",
    "dt": "2025-03-19T18:08:07.686737-07:00",
    "sdt": "2023-07-20T00:00:00.0000+07:00",
    "des": "Daniel's post about cousins",
    "loc": "https://www.facebook.com/sivaneaman/posts/pfbid0RZCCCYdsnTxdjCHz81Nj9T3r1vc1joktFPDoaVuHb46rXFNA8Bj4dRheYUAuQDTql",
    "content": {
      "d": "EHiYE9GSFptXOzr0A0MTU8BG4BIpbCXzeBMlquVIh-Zk",
      "u": "0AAt-NwGI1OZzj7e52Jq9JDD",
      "cargo": "EyetB5DFr6JifdPnVBhSDR6OS1s3mr321AGkRE1BXuaQ"
    }
  },
  "r": "EM6kWxMNL9BFm0ReegqQfNJLw8OZAfn2ZxcjWs4Ceifh"
}